{
  "$id": "https://testatlas.dev/schemas/v1/config.schema.json",
  "$schema": "https://json-schema.org/draft/2020-12/schema",
  "title": "TestAtlas Configuration",
  "type": "object",
  "additionalProperties": false,
  "required": [
    "suiteName",
    "workspaceDir",
    "instructionDir",
    "defaultEnvironment",
    "safeMode",
    "allowDestructiveActions",
    "allowProductionTesting",
    "evidence",
    "explorers",
    "qualityBars",
    "adapters",
    "pinnedVersion",
    "disableUpdateCheck",
    "updateCheckTtlHours"
  ],
  "properties": {
    "$schema": { "type": "string" },
    "suiteName": { "type": "string", "const": "TestAtlas" },
    "workspaceDir": { "type": "string", "minLength": 1 },
    "instructionDir": { "type": "string", "minLength": 1 },
    "defaultEnvironment": {
      "type": "string",
      "enum": ["local", "staging", "preview", "production"]
    },
    "safeMode": { "type": "boolean" },
    "allowDestructiveActions": { "type": "boolean" },
    "allowProductionTesting": { "type": "boolean" },
    "evidence": {
      "type": "object",
      "additionalProperties": false,
      "required": ["screenshots", "videos", "network", "console", "logs", "api", "db"],
      "properties": {
        "screenshots": { "type": "boolean" },
        "videos": { "type": "boolean" },
        "network": { "type": "boolean" },
        "console": { "type": "boolean" },
        "logs": { "type": "boolean" },
        "api": { "type": "boolean" },
        "db": { "type": "boolean" }
      }
    },
    "explorers": {
      "type": "object",
      "additionalProperties": false,
      "required": [
        "ui",
        "cli",
        "codebase",
        "api",
        "docs",
        "runtime",
        "data",
        "integrations",
        "accessibility",
        "performance"
      ],
      "properties": {
        "ui": { "type": "boolean" },
        "cli": { "type": "boolean" },
        "codebase": { "type": "boolean" },
        "api": { "type": "boolean" },
        "docs": { "type": "boolean" },
        "runtime": { "type": "boolean" },
        "data": { "type": "boolean" },
        "integrations": { "type": "boolean" },
        "accessibility": { "type": "boolean" },
        "performance": { "type": "boolean" }
      }
    },
    "qualityBars": {
      "type": "object",
      "additionalProperties": false,
      "required": [
        "requireIssueEvidence",
        "requireFlowConfidence",
        "requireStatusUpdateAfterCommand",
        "requireArtifactIndexUpdate"
      ],
      "properties": {
        "requireIssueEvidence": { "type": "boolean" },
        "requireFlowConfidence": { "type": "boolean" },
        "requireStatusUpdateAfterCommand": { "type": "boolean" },
        "requireArtifactIndexUpdate": { "type": "boolean" }
      }
    },
    "adapters": {
      "type": "object",
      "additionalProperties": false,
      "required": ["claudeCode", "openCode", "kiloCode", "generic"],
      "properties": {
        "claudeCode": { "type": "boolean" },
        "openCode": { "type": "boolean" },
        "kiloCode": { "type": "boolean" },
        "generic": { "type": "boolean" }
      }
    },
    "pinnedVersion": {
      "oneOf": [
        { "type": "null" },
        { "type": "string", "pattern": "^\\d+\\.\\d+\\.\\d+(-[\\w.-]+)?$" },
        { "type": "string", "pattern": "^\\d+\\.(\\d+|[x*])(\\.[x*])?$" },
        { "type": "string", "pattern": "^[~^]\\d+\\.\\d+\\.\\d+(-[\\w.-]+)?$" },
        { "type": "string", "pattern": "^[<>]=?\\d+\\.\\d+\\.\\d+(-[\\w.-]+)?$" }
      ],
      "description": "Pinned suite version. Accepts: null (no pin); exact semver '1.2.3' or '1.2.3-pre'; partial 'X.Y'/'X.Y.Z' with x/* wildcards; caret/tilde ranges '^1.2.3' / '~1.2.3'; comparator ranges '>=1.2.3' / '<2.0.0'. The runtime semver-satisfies check (scripts/lib/update-core.js) is the authoritative gate for whether a release is in-range; this schema rejects only obviously-malformed strings."
    },
    "disableUpdateCheck": { "type": "boolean" },
    "updateCheckTtlHours": {
      "type": "integer",
      "minimum": 1,
      "maximum": 720
    },
    "pinnedSince": {
      "oneOf": [
        { "type": "null" },
        { "type": "string", "format": "date-time" }
      ],
      "default": null,
      "description": "ISO timestamp when pinnedVersion was first set; auto-populated by update.js when --pin is used"
    },
    "pinAlertThresholdDays": {
      "type": "integer",
      "minimum": 1,
      "default": 90,
      "description": "Days after which an out-of-range pinnedVersion emits a stale-pin warning"
    },
    "idempotencyTtlMs": {
      "type": "integer",
      "minimum": 0,
      "default": 86400000,
      "description": "Cache TTL in milliseconds for explorer idempotency (default 24h); referenced by explore-all/explore-codebase cache-strategy semantics. Quick 260508-syv (Round-11 closure)."
    }
  }
}
